{
  "schemaVersion": "1.0",
  "toolId": "remote-commands",
  "ownerModuleId": "android-tools.remote-commands",
  "title": "Remote Commands",
  "description": "Run remote command templates over SSH, apply text transforms, and keep an execution history.",
  "icon": "tool.remote-commands",
  "category": "Automation",
  "type": "dotnet-surface",
  "primaryRouteId": "workspace",
  "routes": [
    { "routeId": "workspace", "surfaceId": "android-tools.remote-commands.workspace", "title": "Remote Commands", "icon": "route.workspace", "surface": { "kind": "dotnet", "assembly": "surface/RemoteCommands.Surface.dll", "type": "RemoteCommands.Surface.RemoteCommandsSurfaceFactory" } }
  ],
  "homeCard": {
    "summary": "Browse command templates, provide inputs, and run them on a remote host over SSH.",
    "primaryActionLabel": "Open Remote Commands",
    "statusBinding": "module.status",
    "order": 30
  }
}
